[
  { "id": "enterprise-identity", "name": "Enterprise Identity", "category": "foundation", "status": "foundation", "phase": "0.2", "risk": "control-plane", "description": "Service definitions for delegated user, workload, tenant, group, and purpose-of-use identity." },
  { "id": "oidc-saml-identity", "name": "OIDC and SAML Identity", "category": "foundation", "status": "planned", "phase": "0.2", "risk": "control-plane", "description": "Projects verified OIDC or SAML claims into scoped agent identity without trusting prompt content." },
  { "id": "vault-credentials", "name": "HashiCorp Vault Credentials", "category": "foundation", "status": "planned", "phase": "0.2", "risk": "control-plane", "description": "Resolves short-lived secret references from Vault with audit and lease awareness." },
  { "id": "aws-secrets-manager", "name": "AWS Secrets Manager", "category": "foundation", "status": "planned", "phase": "0.2", "risk": "control-plane", "description": "Resolves credential references with workload identity and regional controls." },
  { "id": "azure-key-vault", "name": "Azure Key Vault", "category": "foundation", "status": "planned", "phase": "0.2", "risk": "control-plane", "description": "Resolves secrets through managed identity and auditable Key Vault operations." },
  { "id": "gcp-secret-manager", "name": "GCP Secret Manager", "category": "foundation", "status": "planned", "phase": "0.2", "risk": "control-plane", "description": "Resolves versioned secrets through Google workload identity." },
  { "id": "cyberark-credentials", "name": "CyberArk Credentials", "category": "foundation", "status": "planned", "phase": "0.2", "risk": "control-plane", "description": "Retrieves governed privileged credentials and records checkout context." },
  { "id": "opa-policy", "name": "OPA/Rego Policy", "category": "foundation", "status": "planned", "phase": "0.2", "risk": "control-plane", "description": "Evaluates tool actions through a centralized policy decision point with decision identifiers." },
  { "id": "cedar-policy", "name": "Cedar Policy", "category": "foundation", "status": "planned", "phase": "0.2", "risk": "control-plane", "description": "Evaluates principal, action, resource, and context through Cedar authorization policies." },
  { "id": "enterprise-policy", "name": "Enterprise Scope and Approval Policy", "category": "foundation", "status": "available", "phase": "0.1", "risk": "control-plane", "description": "Enforces Jira project and Confluence space allowlists and approval-gated writes." },
  { "id": "enterprise-dlp", "name": "Enterprise DLP", "category": "foundation", "status": "available", "phase": "0.1", "risk": "control-plane", "description": "Blocks configured credentials, private keys, and regulated identifiers in outbound connector arguments." },
  { "id": "model-gateway", "name": "Enterprise Model Gateway", "category": "foundation", "status": "planned", "phase": "0.2", "risk": "control-plane", "description": "Applies provider, model, region, budget, content-filter, cache, and fallback policy." },
  { "id": "audit-jsonl", "name": "Local Redacted Audit", "category": "foundation", "status": "available", "phase": "0.1", "risk": "control-plane", "description": "Writes owner-only redacted JSONL records from authoritative final tool outcomes." },
  { "id": "audit-otel-siem", "name": "OpenTelemetry and SIEM Audit", "category": "foundation", "status": "planned", "phase": "0.2", "risk": "control-plane", "description": "Exports correlated policy, approval, tool, and external transaction evidence to central systems." },
  { "id": "confluence", "name": "Confluence", "category": "knowledge", "status": "available", "phase": "0.1", "risk": "read", "description": "Searches permission-scoped Confluence content with provenance and tenant policy." },
  { "id": "sharepoint", "name": "Microsoft SharePoint", "category": "knowledge", "status": "planned", "phase": "0.3", "risk": "read", "description": "Provides permission-trimmed document search, retrieval, citations, and page drafts." },
  { "id": "google-drive", "name": "Google Drive", "category": "knowledge", "status": "planned", "phase": "0.3", "risk": "read", "description": "Searches and retrieves Drive content using delegated permissions and classification labels." },
  { "id": "slack", "name": "Slack", "category": "knowledge", "status": "planned", "phase": "0.3", "risk": "propose", "description": "Searches authorized conversations and creates outbound message drafts before approval." },
  { "id": "microsoft-teams", "name": "Microsoft Teams", "category": "knowledge", "status": "planned", "phase": "0.3", "risk": "propose", "description": "Searches permitted Teams content and creates approval-gated message drafts." },
  { "id": "enterprise-email", "name": "Enterprise Email", "category": "knowledge", "status": "planned", "phase": "0.4", "risk": "propose", "description": "Searches governed mailboxes and creates draft-only outbound messages by default." },
  { "id": "federated-search", "name": "Federated Enterprise Search", "category": "knowledge", "status": "planned", "phase": "0.3", "risk": "read", "description": "Combines ACL-filtered providers with provenance, ranking, freshness, and classification metadata." },
  { "id": "jira", "name": "Jira", "category": "work-management", "status": "available", "phase": "0.1", "risk": "write", "description": "Reads, reviews, and approval-gates issue creation through typed operations." },
  { "id": "servicenow", "name": "ServiceNow", "category": "work-management", "status": "planned", "phase": "0.4", "risk": "write", "description": "Searches records and proposes or executes approval-gated incidents and change requests." },
  { "id": "linear", "name": "Linear", "category": "work-management", "status": "planned", "phase": "0.3", "risk": "write", "description": "Reads issues and creates scoped proposals with idempotency and audit evidence." },
  { "id": "github-enterprise", "name": "GitHub Enterprise", "category": "engineering", "status": "planned", "phase": "0.4", "risk": "propose", "description": "Reads repositories and proposes changes subject to branch protection and code ownership." },
  { "id": "gitlab", "name": "GitLab", "category": "engineering", "status": "planned", "phase": "0.4", "risk": "propose", "description": "Reads projects and proposes merge requests with protected-branch and approval controls." },
  { "id": "bitbucket", "name": "Bitbucket", "category": "engineering", "status": "planned", "phase": "0.4", "risk": "propose", "description": "Reads repositories and proposes pull requests through workspace and branch policy." },
  { "id": "ci-evidence", "name": "CI and Change Evidence", "category": "engineering", "status": "planned", "phase": "0.4", "risk": "read", "description": "Collects build, test, artifact, deployment, and change-management evidence." },
  { "id": "vulnerability-management", "name": "Vulnerability Management", "category": "security-operations", "status": "planned", "phase": "0.3", "risk": "propose", "description": "Normalizes Snyk, Wiz, Prisma, Defender, Tenable, Qualys, and internal findings." },
  { "id": "soc-operations", "name": "SOC Operations", "category": "security-operations", "status": "planned", "phase": "0.4", "risk": "write", "description": "Queries SIEM data, proposes case actions, and approval-gates containment operations." },
  { "id": "software-supply-chain", "name": "Software Supply Chain", "category": "security-operations", "status": "planned", "phase": "0.3", "risk": "control-plane", "description": "Enforces SBOM, license, provenance, signing, dependency, and artifact admission controls." },
  { "id": "cloud-kubernetes", "name": "Cloud and Kubernetes", "category": "infrastructure", "status": "planned", "phase": "0.4", "risk": "write", "description": "Provides inventory reads and separates plan, approve, apply, and verify infrastructure operations." },
  { "id": "vendor-risk", "name": "Procurement and Vendor Risk", "category": "business-controls", "status": "planned", "phase": "0.4", "risk": "propose", "description": "Collects vendor evidence and drafts governed risk reviews and procurement workflows." },
  { "id": "legal-contract", "name": "Legal and Contract Review", "category": "business-controls", "status": "planned", "phase": "0.4", "risk": "propose", "description": "Retrieves approved clauses and drafts reviews without granting autonomous legal authority." },
  { "id": "privacy-impact", "name": "Privacy Impact Assessment", "category": "business-controls", "status": "planned", "phase": "0.4", "risk": "propose", "description": "Collects data-flow facts and drafts privacy assessments with reviewer checkpoints." },
  { "id": "records-retention", "name": "Records Retention", "category": "business-controls", "status": "planned", "phase": "0.5", "risk": "control-plane", "description": "Projects retention, legal-hold, deletion, and residency policy into connector operations." },
  { "id": "finance-erp", "name": "Finance and ERP", "category": "business-controls", "status": "planned", "phase": "0.5", "risk": "write", "description": "Provides strongly scoped finance reads and separation-of-duties approval for mutations." },
  { "id": "hris", "name": "Human Resources Information Systems", "category": "business-controls", "status": "planned", "phase": "0.5", "risk": "write", "description": "Provides privacy-sensitive HR workflows with field minimization and strict authorization." },
  { "id": "customer-support", "name": "Customer Support", "category": "business-controls", "status": "planned", "phase": "0.4", "risk": "propose", "description": "Retrieves authorized cases and drafts responses with customer-data and send controls." }
]
